{
  "schema_version": "0.000001",
  "request_id": "11111111-1111-4111-8111-111111111111",
  "created_at": "2026-08-31T09:00:00Z",
  "requested_by": "simo",
  "target": "staging",
  "database_change": "no",
  "release_parts": [
    {
      "id": "backend",
      "repository": "6529seize-backend",
      "pull_requests": [
        {
          "number": 123,
          "branch": "feature/backend-change",
          "commit": "aaaaaaaaaaaaaaaaaaaaaaaaaaaaaaaaaaaaaaaa"
        }
      ],
      "depends_on": [],
      "deploy_units": ["api"],
      "deploy_dependencies": []
    },
    {
      "id": "frontend",
      "repository": "6529seize-frontend",
      "pull_requests": [
        {
          "number": 456,
          "branch": "feature/frontend-change",
          "commit": "bbbbbbbbbbbbbbbbbbbbbbbbbbbbbbbbbbbbbbbb"
        }
      ],
      "depends_on": ["backend"]
    }
  ]
}
